TTSRec00001|Author of the danger trail, Philip Steels, etc.
TTSRec00002|Not at this particular case, Tom, apologized Whittemore.
TTSRec00003|For the twentieth time that evening the two men shook hands.
TTSRec00004|Lord, but I'm glad to see you again, Phil.
TTSRec00005|Will we ever forget it.
TTSRec00006|God bless 'em, I hope I'll go on seeing them forever.
TTSRec00007|And you always want to see it in the superlative degree.
TTSRec00008|Gad, your letter came just in time.
TTSRec00009|He turned sharply, and faced Gregson across the table.
TTSRec00010|I'm playing a single hand in what looks like a losing game.
TTSRec00011|If I ever needed a fighter in my life I need one now.
TTSRec00012|Gregson shoved back his chair and rose to his feet.
TTSRec00013|He was a head shorter than his companion, of almost delicate physique.
TTSRec00014|Now you're coming down to business, Phil, he exclaimed.
TTSRec00015|It's the aurora borealis.
TTSRec00016|There's Fort Churchill, a rifle-shot beyond the ridge, asleep.
TTSRec00017|From that moment his friendship for Belize turns to hatred and jealousy.
TTSRec00018|There was a change now.
TTSRec00019|I followed the line of the proposed railroad, looking for chances.
TTSRec00020|Clubs and balls and cities grew to be only memories.
TTSRec00021|It fairly clubbed me into recognizing it.
TTSRec00022|Hardly were our plans made public before we were met by powerful opposition.
TTSRec00023|A combination of Canadian capital quickly organized and petitioned for the same privileges.
TTSRec00024|It was my reports from the north which chiefly induced people to buy.
TTSRec00025|I was about to do this when cooler judgment prevailed.
TTSRec00026|It occurred to me that there would have to be an accounting.
TTSRec00027|To my surprise he began to show actual enthusiasm in my favor.
TTSRec00028|Robbery, bribery, fraud, 
TTSRec00029|Their forces were already moving into the north country.
TTSRec00030|I had faith in them.
TTSRec00031|They were three hundred yards apart.
TTSRec00032|Since then some mysterious force has been fighting us at every step.
TTSRec00033|He unfolded a long typewritten letter, and handed it to Gregson.
TTSRec00034|Men of Selden's stamp don't stop at women and children.
TTSRec00035|He stopped, and Philip nodded at the horrified question in his eyes.
TTSRec00036|She turned in at the hotel.
TTSRec00037|I was the only one who remained sitting.
TTSRec00038|We'll have to watch our chances.
TTSRec00039|The ship should be in within a week or ten days.
TTSRec00040|I suppose you wonder why she is coming up here.
TTSRec00041|Meanwhile I'll go out to breathe a spell.
TTSRec00042|How could he explain his possession of the sketch.
TTSRec00043|It seemed nearer to him since he had seen and talked with Gregson.
TTSRec00044|Her own betrayal of herself was like tonic to Philip.
TTSRec00045|He moved away as quietly as he had come.
TTSRec00046|The girl faced him, her eyes shining with sudden fear.
TTSRec00047|Close beside him gleamed the white fangs of the wolf-dog.
TTSRec00048|He looked at the handkerchief more, closely.
TTSRec00049|Gregson was asleep when he re-entered the cabin.
TTSRec00050|In spite of their absurdity the words affected Philip curiously.
TTSRec00051|The lace was of a delicate ivory color, faintly tinted with yellow.
TTSRec00052|It was a curious coincidence.
TTSRec00053|Suddenly his fingers closed tightly over the handkerchief.
TTSRec00054|There was nothing on the rock.
TTSRec00055|Philip stood undecided, his ears strained to catch the slightest sound.
TTSRec00056|Pearce's little eyes were fixed on him shrewdly.
TTSRec00057|I have no idea, replied Philip.
TTSRec00058|I came for information more out of curiosity than anything else.
TTSRec00059|His immaculate appearance was gone.
TTSRec00060|Anyway, no one saw her like that.
TTSRec00061|Philip snatched at the letter which Gregson held out to him.
TTSRec00062|The men stared into each other's face.
TTSRec00063|Yes, it was a man who asked, a stranger.
TTSRec00064|The fourth and fifth days passed without any developments.
TTSRec00065|They closed now until his fingers were like cords of steel.
TTSRec00066|He saw Jeanne falter for a moment.
TTSRec00067|Surely I will excuse you, she cried.
TTSRec00068|In a flash Philip followed its direction.
TTSRec00069|It was his intention to return to Eileen and her father.
TTSRec00070|He would first hunt up Gregson and begin his work there.
TTSRec00071|What was the object of your little sensation.
TTSRec00072|But who was Eileen's double.
TTSRec00073|The promoter's eyes were heavy, with little puffy bags under them.
TTSRec00074|And now, down there, Eileen was waiting for him.
TTSRec00075|There has been a change, she interrupted him.
TTSRec00076|The gray eyes faltered; the flush deepened.
TTSRec00077|It is the fire, partly, she said.
TTSRec00078|Then, and at supper, he tried to fathom her.
TTSRec00079|It was a large canoe.
TTSRec00080|What if Jeanne failed him.
TTSRec00081|What if she did not come to the rock.
TTSRec00082|His face was streaming with blood.
TTSRec00083|A shadow was creeping over Pierre's eyes.
TTSRec00084|Scarcely had he uttered the name when Pierre's closing eyes shot open.
TTSRec00085|A trickle of fresh blood ran over his face.
TTSRec00086|Death had come with terrible suddenness.
TTSRec00087|Philip bent lower, and stared into the face of the dead man.
TTSRec00088|He made sure that the magazine was loaded, and resumed his paddling.
TTSRec00089|The nightglow was treacherous to shoot by.
TTSRec00090|The singing voice approached rapidly.
TTSRec00091|His blood grew hot with rage at the thought.
TTSRec00092|He went down in midstream, searching the shadows of both shores.
TTSRec00093|For a full minute he crouched and listened.
TTSRec00094|He had barely entered this when he saw the glow of a fire.
TTSRec00095|A big canvas tent was the first thing to come within his vision.
TTSRec00096|Perhaps she had already met her fate a little deeper in the forest.
TTSRec00097|Then you can arrange yourself comfortably among these robes in the bow.
TTSRec00098|Shall I carry you.
TTSRec00099|A maddening joy pounded in his brain.
TTSRec00100|You must sleep, he urged.
TTSRec00101|You, you would not keep the truth from me.
TTSRec00102|He will follow us soon.
TTSRec00103|But there came no promise from the bow of the canoe.
TTSRec00104|She was sleeping under his protection as sweetly as a child.
TTSRec00105|Only, it is so wonderful, so almost impossible to believe.
TTSRec00106|The emotion which she had suppressed burst forth now in a choking sob.
TTSRec00107|If you only could know how I thank you.
TTSRec00108|He waded into the edge of the water and began scrubbing himself.
TTSRec00109|Do you know that you are shaking my confidence in you.
TTSRec00110|Much, replied Jeanne, as tersely.
TTSRec00111|Instead, he joined her; and they ate like two hungry children.
TTSRec00112|He was wounded in the arm.
TTSRec00113|I suppose you picked that lingo up among the Indians.
TTSRec00114|Her words sent a strange chill through Philip.
TTSRec00115|He had no excuse for the feelings which were aroused in him.
TTSRec00116|Was it the rendezvous of those who were striving to work his ruin.
TTSRec00117|She added, with genuine sympathy in her face and voice.
TTSRec00118|Pierre obeys me when we are together.
TTSRec00119|Jeanne was turning the bow shoreward.
TTSRec00120|My right foot feels like that of a Chinese debutante.
TTSRec00121|They ate dinner at the fifth, and rested for two hours.
TTSRec00122|Two years ago I gave up civilization for this.
TTSRec00123|She had died from cold and starvation.
TTSRec00124|It was Jeanne singing softly over beyond the rocks.
TTSRec00125|He was determined now to maintain a more certain hold upon himself.
TTSRec00126|Each day she became a more vital part of him.
TTSRec00127|It was a temptation, but he resisted it.
TTSRec00128|This one hope was destroyed as quickly as it was born.
TTSRec00129|Her face was against his breast.
TTSRec00130|She was his now, forever.
TTSRec00131|Providence had delivered him through the maelstrom.
TTSRec00132|A cry of joy burst from Philip's lips.
TTSRec00133|Philip began to feel that he had foolishly overestimated his strength.
TTSRec00134|He obeyed the pressure of her hand.
TTSRec00135|I am going to surprise father, and you will go with Pierre.
TTSRec00136|About him, everywhere, were the evidences of luxury and of age.
TTSRec00137|Then he stepped back with a low cry of pleasure.
TTSRec00138|In the picture he saw each moment a greater resemblance to Jeanne.
TTSRec00139|He told himself that as he washed himself and groomed his disheveled clothes.
TTSRec00140|Accept a father's blessing, and with it, this.
TTSRec00141|It seems like a strange pointing of the hand of God.
TTSRec00142|Such things had occurred before, he told Philip.
TTSRec00143|Ah, I had forgotten, he exclaimed.
TTSRec00144|But there was something even more startling than this resemblance.
TTSRec00145|I have to be careful of them, as they tear very easily.
TTSRec00146|Of course, that is uninteresting, she continued.
TTSRec00147|A moment before he was intoxicated by a joy that was almost madness.
TTSRec00148|Now these things had been struck dead within him.
TTSRec00149|For an instant he saw Pierre drawn like a silhouette against the sky.
TTSRec00150|Goodbye, Pierre, he shouted.
TTSRec00151|And MacDougall was beyond the trail, with three weeks to spare.
TTSRec00152|Philip thrust himself against it and entered.
TTSRec00153|MacDougall tapped his forehead suspiciously with a stubby forefinger.
TTSRec00154|He was smooth-shaven, and his hair and eyes were black.
TTSRec00155|Won't you draw up, gentlemen.
TTSRec00156|A strange fire burned in his eyes when Thorpe turned.
TTSRec00157|He had worshiped her, as Dante might have worshiped Beatrice.
TTSRec00158|Does that look good.
TTSRec00159|They look as though he had been drumming a piano all his life.
TTSRec00160|You want to go over and see his gang throw dirt.
TTSRec00161|Take away their foreman and they wouldn't be worth their grub.
TTSRec00162|That's the sub-foreman, explained Thorpe.
TTSRec00163|Philip made no effort to follow.
TTSRec00164|He came first a year ago, and revealed himself to Jeanne.
TTSRec00165|They are to attack your camp tomorrow night.
TTSRec00166|Two days ago Jeanne learned where her father's men were hiding.
TTSRec00167|I was near the cabin, and saw you.
TTSRec00168|Low bush whipped him in the face and left no sting.
TTSRec00169|Suddenly Jeanne stopped for an instant.
TTSRec00170|There was none of the joy of meeting in his face.
TTSRec00171|And when you come back in a few days, bring Eileen.
TTSRec00172|Gregson had left the outer door slightly ajar.
TTSRec00173|The date was nearly eighteen years old.
TTSRec00174|They were the presage of storm.
TTSRec00175|Down there the earth was already swelling with life.
TTSRec00176|For the first time in his life he was yearning for a scrap.
TTSRec00177|She had been thoroughly and efficiently mauled.
TTSRec00178|Every bone in her aged body seemed broken or dislocated.
TTSRec00179|Tomorrow I'm going after that bear, he said.
TTSRec00180|If not, let's say our prayers and go to bed.
TTSRec00181|So cheer up, and give us your paw.
TTSRec00182|This time he did not yap for mercy.
TTSRec00183|And the air was growing chilly.
TTSRec00184|Don't you see, I'm chewing this thing in two.
TTSRec00185|The questions may have come vaguely in his mind.
TTSRec00186|Like a flash he launched himself into the feathered mass of the owl.
TTSRec00187|Ahead of them they saw a glimmer of sunshine.
TTSRec00188|Two gigantic owls were tearing at the carcass.
TTSRec00189|The big-eyed, clucking moose-birds were most annoying.
TTSRec00190|Next to them the Canada jays were most persistent.
TTSRec00191|For a time the exciting thrill of his adventure was gone.
TTSRec00192|He did not rush in.
TTSRec00193|It was edged with ice.
TTSRec00194|He drank of the water cautiously.
TTSRec00195|But a strange thing happened.
TTSRec00196|He began to follow the footprints of the dog.
TTSRec00197|Such a dog the wise driver kills, or turns loose.
TTSRec00198|Sometimes her dreams were filled with visions.
TTSRec00199|Thus had the raw wilderness prepared him for this day.
TTSRec00200|He leapt again, and the club caught him once more.
TTSRec00201|He cried, and swung the club wildly.
TTSRec00202|She turned, fearing that Jacques might see what was in her face.
TTSRec00203|They were following the shore of a lake.
TTSRec00204|The wolf-dog thrust his gaunt muzzle toward him.
TTSRec00205|From now on we're pals.
TTSRec00206|He says he bought him of Jacques Le Beau.
TTSRec00207|How much was it.
TTSRec00208|Youth had come back to her, freed from the yoke of oppression.
TTSRec00209|It was not a large lake, and almost round.
TTSRec00210|Its diameter was not more than two hundred yards.
TTSRec00211|It drowned all sound that brute agony and death may have made.
TTSRec00212|Fresh cases, still able to walk, they clustered about the spokesman.
TTSRec00213|Between him and the beach was the cane-grass fence of the compound.
TTSRec00214|Besides, he was paid one case of tobacco per head.
TTSRec00215|They die out of spite.
TTSRec00216|The other felt a sudden wave of irritation rush through him.
TTSRec00217|Oppressive as the heat had been, it was now even more oppressive.
TTSRec00218|The ringing of the big bell aroused him.
TTSRec00219|At first he puzzled over something untoward he was sure had happened.
TTSRec00220|A dead man is of no use on a plantation.
TTSRec00221|I don't know why you're here at all.
TTSRec00222|What part of the United States is your home.
TTSRec00223|My, I'm almost homesick for it already.
TTSRec00224|She nodded, and her eyes grew soft and moist.
TTSRec00225|I was brought up the way most girls in Hawaii are brought up.
TTSRec00226|That came before my A B C's.
TTSRec00227|It was the same way with our revolvers and rifles.
TTSRec00228|But it contributed to the smash.
TTSRec00229|The last one I knew was an overseer.
TTSRec00230|Do you know any good land around here.
TTSRec00231|The Resident Commissioner is away in Australia.
TTSRec00232|I cannot follow you, she said.
TTSRec00233|I never allow what can't be changed to annoy me.
TTSRec00234|Why, the average review is more nauseating than cod liver oil.
TTSRec00235|His voice was passionately rebellious.
TTSRec00236|Don't you see I hate you.
TTSRec00237|So Hughie and I did the managing ourselves.
TTSRec00238|It happened to him at the Gallina Society in Oakland one afternoon.
TTSRec00239|He cried in such genuine dismay that she broke into hearty laughter.
TTSRec00240|Wash your hands of me.
TTSRec00241|I think it's much nicer to quarrel.
TTSRec00242|I saw it when she rolled.
TTSRec00243|I only read the quotations.
TTSRec00244|He was the soul of devotion to his employers.
TTSRec00245|Out of his eighteen hundred, he laid aside sixteen hundred each year.
TTSRec00246|You have heard always how he was the lover of the Princess Naomi.
TTSRec00247|They ought to pass here some time today.
TTSRec00248|I had been sad too long already.
TTSRec00249|All eyes, however, were staring at him in certitude of expectancy.
TTSRec00250|He had observed the business life of Hawaii and developed a vaulting ambition.
TTSRec00251|I may manage to freight a cargo back as well.
TTSRec00252|O'Brien had been a clean living young man with ideals.
TTSRec00253|He it was that lived to found the family of the Patino.
TTSRec00254|Straight out they swam, their heads growing smaller and smaller.
TTSRec00255|You won't die of malnutrition, be sure of that.
TTSRec00256|See the length of the body and that elongated neck.
TTSRec00257|They are coming ashore, whoever they are.
TTSRec00258|Soaked in seawater they offset the heat rays.
TTSRec00259|Think of investing in such an adventure.
TTSRec00260|Nobody knew his history, they of the Junta least of all.
TTSRec00261|I have been doubly baptized.
TTSRec00262|They wouldn't be sweeping a big vessel like the Martha.
TTSRec00263|Joan looked triumphantly at Sheldon, who bowed.
TTSRec00264|And I hope you've got plenty of chain out, Captain Young.
TTSRec00265|The discovery seemed to have been made on the spur of the moment.
TTSRec00266|They handled two men already, both grub-thieves.
TTSRec00267|Eli Harding asked, as Shunk started to follow.
TTSRec00268|Now go ahead and tell me in a straightforward way what has happened.
TTSRec00269|That's where they cut off the Scottish Chiefs and killed all hands.
TTSRec00270|And after the bath a shave would not be bad.
TTSRec00271|Now please give a plain statement of what occurred.
TTSRec00272|You can take a vacation on pay.
TTSRec00273|They are big trees and require plenty of room.
TTSRec00274|And Raoul listened again to the tale of the house.
TTSRec00275|There are no kiddies and half grown youths among them.
TTSRec00276|Oolong Atoll was one hundred and forty miles in circumference.
TTSRec00277|McCoy found a stifling, poisonous atmosphere in the pent cabin.
TTSRec00278|It would give me nervous prostration.
TTSRec00279|She said with chattering teeth.
TTSRec00280|I'll be out of my head in fifteen minutes.
TTSRec00281|I do not blame you for anything; remember that.
TTSRec00282|If you mean to insinuate -- Brentwood began hotly.
TTSRec00283|The woman in you is only incidental, accidental, and irrelevant.
TTSRec00284|There was no forecasting this strange girl's processes.
TTSRec00285|But what they want with your toothbrush is more than I can imagine.
TTSRec00286|Give them their choice between a fine or an official whipping.
TTSRec00287|Keep an eye on him.
TTSRec00288|Those are my oysters, he said at last.
TTSRec00289|They are not regular oyster pirates, Nicholas continued.
TTSRec00290|One by one the boys were captured.
TTSRec00291|The weeks had gone by, and no overt acts had been attempted.
TTSRec00292|Here, in the midmorning, the first casualty occurred.
TTSRec00293|They were deep in the primeval forest.
TTSRec00294|He had been foiled in his attempt to escape.
TTSRec00295|And twenty men could hold it with spears and arrows.
TTSRec00296|Bassett was a fastidious man.
TTSRec00297|There's a big English general right now whose name is Roberts.
TTSRec00298|This tacit promise of continued acquaintance gave Saxon a little joy-thrill.
TTSRec00299|I tell you I am disgusted with this adventure tomfoolery and rot.
TTSRec00300|From my earliest recollection my sleep was a period of terror.
TTSRec00301|But all my dreams violated this law.
TTSRec00302|It is very plausible to such people, a most convincing hypothesis.
TTSRec00303|But they make the mistake of ignoring their own duality.
TTSRec00304|I graduated last of my class.
TTSRec00305|They had no fixed values, to be altered by adjectives and adverbs.
TTSRec00306|He was pressing beyond the limits of his vocabulary.
TTSRec00307|Very early in my life, I separated from my mother.
TTSRec00308|His infernal chattering worries me even now as I think of it.
TTSRec00309|White Leghorns, said Mrs Mortimer.
TTSRec00310|Massage under tension, was the cryptic reply.
TTSRec00311|Therefore, hurrah for the game.
TTSRec00312|It lived in perpetual apprehension of that quarter of the compass.
TTSRec00313|Broken-Tooth yelled with fright and pain.
TTSRec00314|Thus was momentum gained in the Younger World.
TTSRec00315|Saxon waited, for she knew a fresh idea had struck Billy.
TTSRec00316|We had been chased by them ourselves, more than once.
TTSRec00317|He was a wise hyena.
TTSRec00318|Production is doubling and quadrupling upon itself.
TTSRec00319|And the Edinburgh Evening News says, with editorial gloom.
TTSRec00320|With my strength I slammed it full into Red-Eye's face.
TTSRec00321|The log on which Lop-Ear was lying got adrift.
TTSRec00322|This is a common experience with all of us.
TTSRec00323|He considered the victory already his and stepped forward to the meat.
TTSRec00324|It was not Red-Eye's way to forego revenge so easily.
TTSRec00325|Whiz-zip-bang. Lop-Ear screamed with sudden anguish.
TTSRec00326|Cherokee identified himself with his instinct.
TTSRec00327|They were less stooped than we, less springy in their movements.
TTSRec00328|The Fire People, like ourselves, lived in caves.
TTSRec00329|Ah, indeed.
TTSRec00330|Red-Eye never committed a more outrageous deed.
TTSRec00331|Poor little Crooked-Leg was terribly scared.
TTSRec00332|Unconsciously, our yells and exclamations yielded to this rhythm.
TTSRec00333|This is no place for you.
TTSRec00334|He'll knock you off a few sticks in no time.
TTSRec00335|Red-Eye swung back and forth on the branch farther down.
TTSRec00336|So unexpected was my charge that I knocked him off his feet.
TTSRec00337|Encouraged by my conduct, Big-Face became a sudden ally.
TTSRec00338|The fighting had now become intermittent.
TTSRec00339|They obeyed him, and went here and there at his commands.
TTSRec00340|It was like the beating of hoofs.
TTSRec00341|Why, doggone you all, shake again.
TTSRec00342|Seventeen, no, eighteen days ago.
TTSRec00343|You mean for this State, General, Alberta.
TTSRec00344|He seemed to fill it with his tremendous vitality.
TTSRec00345|She was trying to pass the apron string around him.
TTSRec00346|Get down and dig in.
TTSRec00347|They are greatly delighted with anything that is bright or giveth a sound.
TTSRec00348|They only lifted seven hundred and fifty.
TTSRec00349|It was simple, in its way, and no virtue of his.
TTSRec00350|Is that Pat Hanrahan's mug looking hungry and willing.
TTSRec00351|It was more like sugar.
TTSRec00352|I'm sure going along with you all, Elijah.
TTSRec00353|Here the explosion of mirth drowned him out.
TTSRec00354|Fresh meat they failed to obtain.
TTSRec00355|A burst of laughter was his reward.
TTSRec00356|You don't catch me at any such foolishness.
TTSRec00357|A month passed by, and Bonanza Creek remained quiet.
TTSRec00358|They continued valiantly to lie, but the truth continued to outrun them.
TTSRec00359|Earth and gravel seemed to fill the pan.
TTSRec00360|But he no longer cared quite so much for that form of diversion.
TTSRec00361|But he did not broach it, preferring to mature it carefully.
TTSRec00362|Nope, not the slightest idea.
TTSRec00363|It is not an attempt to smash the market.
TTSRec00364|We have plenty of capital ourselves, and yet we want more.
TTSRec00365|These rumors may even originate with us.
TTSRec00366|A wildly exciting time was his during the week preceding Thursday the eighteenth.
TTSRec00367|There is not an iota of truth in it, certainly not.
TTSRec00368|I just do appreciate it without being able to express my feelings.
TTSRec00369|In partnership with Daylight, the pair raided the San Jose Interurban.
TTSRec00370|He saw all men in the business game doing this.
TTSRec00371|It issued a rate of forty two dollars a car on charcoal.
TTSRec00372|He saw only the effect in a general, sketchy way.
TTSRec00373|Points of view, new ideas, life.
TTSRec00374|But life's worth more than cash, she argued.
TTSRec00375|The butchers and meat cutters refused to handle meat destined for unfair restaurants.
TTSRec00376|Your price, my son, is just about thirty per week.
TTSRec00377|This sound did not disturb the hush and awe of the place.
TTSRec00378|That's why its boundaries are all gouged and jagged.
TTSRec00379|How old are you, daddy.
TTSRec00380|But in the canyons water was plentiful and also a luxuriant forest growth.
TTSRec00381|My name's Ferguson.
TTSRec00382|Daylight found himself charmed and made curious by the little man.
TTSRec00383|To his surprise, her answer was flat and uncompromising.
TTSRec00384|The farmer works the soil and produces grain.
TTSRec00385|That's what Carnegie did.
TTSRec00386|I can't argue with you, and you know that.
TTSRec00387|Bob, growing disgusted, turned back suddenly and attempted to pass Mab.
TTSRec00388|It was my idea to a tee.
TTSRec00389|Mab, she said.
TTSRec00390|I'll go over tomorrow afternoon.
TTSRec00391|But he reconciled himself to it by an act of faith.
TTSRec00392|There is that magnificent Bob, eating his head off in the stable.
TTSRec00393|Already he had begun borrowing from the banks.
TTSRec00394|It's the strap hangers that'll keep us from going under.
TTSRec00395|As for himself, weren't the street railway earnings increasing steadily.
TTSRec00396|A rising tide of fat had submerged them.
TTSRec00397|Call me that again, he murmured ecstatically.
TTSRec00398|In the car were Unwin and Harrison, while Jones sat with the chauffeur.
TTSRec00399|And here's another idea.
TTSRec00400|Manuel had one besetting sin.
TTSRec00401|The man smiled grimly, and brought a hatchet and a club.
TTSRec00402|Curly rushed her antagonist, who struck again and leaped aside.
TTSRec00403|His newborn cunning gave him poise and control.
TTSRec00404|Perrault found one with head buried in the grub box.
TTSRec00405|It seemed the ordained order of things that dogs should work.
TTSRec00406|And that was the last of Francois and Perrault.
TTSRec00407|Mercedes screamed, cried, laughed, and manifested the chaotic abandonment of hysteria.
TTSRec00408|The Eldorado emptied its occupants into the street to see the test.
TTSRec00409|He could feel a new stir in the land.
TTSRec00410|So we have to fit the boat throughout with oil lamps as well.
TTSRec00411|It will break our hearts and our backs to hoist anchor by hand.
TTSRec00412|There is another virtue in these bulkheads.
TTSRec00413|But I am at the end of my resources.
TTSRec00414|Now our figuring was all right.
TTSRec00415|It lasted as a deterrent for two days.
TTSRec00416|The added weight had a velocity of fifteen miles per hour.
TTSRec00417|It is also an insidious, deceitful sun.
TTSRec00418|The Portuguese boy crawled nearer and nearer.
TTSRec00419|The Portuguese boy passed the Hawaiian.
TTSRec00420|When I came to I was waving my hat and murmuring ecstatically.
TTSRec00421|By golly, the boy wins.
TTSRec00422|Halfway around the track one donkey got into an argument with its rider.
TTSRec00423|McVeigh when he returns from a trip to Honolulu.
