TTSRec00851|You fired me out of your house, in short.
TTSRec00852|Her mouth opened, but instead of speaking she drew a long sigh.
TTSRec00853|It's worth eight dollars.
TTSRec00854|And he did hurt my arm.
TTSRec00855|Saxon's onto her job.
TTSRec00856|Only once did I confide the strangeness of it all to another.
TTSRec00857|But this time it was Saxon who rebelled.
TTSRec00858|I was not to cry out in the face of fear.
TTSRec00859|And now put yourself in my place for a moment.
TTSRec00860|The boy threw back his head with pride.
TTSRec00861|Saxon nodded, and the boy frowned.
TTSRec00862|Why not like any railroad station or ferry depot.
TTSRec00863|We could throw stones with our feet.
TTSRec00864|It was put together in a casual, helter-skelter sort of way.
TTSRec00865|These were merely stout sticks an inch or so in diameter.
TTSRec00866|Then it was that a strange thing happened.
TTSRec00867|From the source of light a harsh voice said.
TTSRec00868|But I did not enjoy it long.
TTSRec00869|We were now good friends.
TTSRec00870|Two of the Folk were already up.
TTSRec00871|Now animals do not like mockery.
TTSRec00872|He gave one last snarl and slid from view among the trees.
TTSRec00873|Again the girls applauded, and Mrs Hall cried.
TTSRec00874|Just the same I'd sooner be myself than have book indigestion.
TTSRec00875|Some of the smaller veins had doubtless been ruptured.
TTSRec00876|But we were without this momentum.
TTSRec00877|There was one difficulty, however.
TTSRec00878|The hyena proceeded to dine.
TTSRec00879|The time was considered auspicious.
TTSRec00880|Or have they already devised one.
TTSRec00881|We would not spend another such night.
TTSRec00882|At first his progress was slow and erratic.